{
  "scene_id": "cozy_office_v0",
  "version": 1,
  "office_shell": {
    "url": "assets/glb/office_shell.glb",
    "transform": {
      "pos": [
        0,
        0,
        0
      ],
      "rot": [
        0,
        0,
        0
      ],
      "scale": [
        1,
        1,
        1
      ]
    },
    "collision": {
      "mode": "manifest"
    }
  },
  "pois": [
    {
      "poi_id": "poi_reception_inbox",
      "type": "inbox",
      "nav_anchors": [
        {
          "id": "stand",
          "pos": [
            2.4,
            0,
            -1.2
          ],
          "facing": [
            -1,
            0,
            0
          ]
        }
      ],
      "interaction_radius_m": 1.25,
      "ui_anchor": {
        "pos": [
          2.25,
          1.05,
          -1.15
        ],
        "facing": [
          -1,
          0,
          0
        ],
        "size": [
          1.2,
          0.8
        ]
      },
      "camera_framing": {
        "kind": "poi",
        "offset": [
          0,
          1.2,
          1.8
        ],
        "zoom": 1.05
      },
      "capacity": 1,
      "highlight_nodes": [
        "Head",
        "LeftHand"
      ],
      "interaction": {
        "type": "open_panel",
        "panel": "inbox"
      }
    },
    {
      "poi_id": "poi_task_board",
      "type": "task_board",
      "nav_anchors": [
        {
          "id": "stand",
          "pos": [
            1.2,
            0,
            2
          ],
          "facing": [
            0,
            0,
            -1
          ]
        }
      ],
      "interaction_radius_m": 1.25,
      "ui_anchor": {
        "pos": [
          1.2,
          1.1,
          1.8
        ],
        "facing": [
          0,
          0,
          -1
        ],
        "size": [
          1.4,
          0.9
        ]
      },
      "camera_framing": {
        "kind": "poi",
        "offset": [
          0,
          1.2,
          1.8
        ],
        "zoom": 1.05
      },
      "capacity": 2,
      "highlight_nodes": [
        "Spine",
        "RightHand"
      ],
      "interaction": {
        "type": "open_panel",
        "panel": "task_board"
      }
    },
    {
      "poi_id": "poi_delivery_shelf",
      "type": "delivery_shelf",
      "nav_anchors": [
        {
          "id": "stand",
          "pos": [
            -1.2,
            0,
            2.1
          ],
          "facing": [
            1,
            0,
            0
          ]
        }
      ],
      "interaction_radius_m": 1.25,
      "capacity": 1,
      "highlight_nodes": [
        "Hips"
      ],
      "interaction": {
        "type": "open_panel",
        "panel": "deliverables"
      }
    }
  ],
  "objects": [
    {
      "id": "delivery_shelf",
      "url": "assets/glb/shelf.glb",
      "transform": {
        "pos": [
          -1,
          0,
          2.2
        ],
        "rot": [
          0,
          0,
          0
        ],
        "scale": [
          1,
          1,
          1
        ]
      },
      "tags": [
        "prop",
        "interactive"
      ],
      "collider": {
        "type": "box",
        "size": [
          1.2,
          1.8,
          0.4
        ],
        "offset": [
          0,
          0.9,
          0
        ]
      },
      "interaction": {
        "type": "open_panel",
        "panel": "deliverables"
      },
      "poi_id": "poi_delivery_shelf",
      "interaction_radius_m": 1.25,
      "highlight_nodes": [
        "Hips"
      ]
    },
    {
      "id": "desk_01",
      "url": "assets/glb/desk.glb",
      "transform": {
        "pos": [
          0.5,
          0,
          0.4
        ],
        "rot": [
          0,
          1.57,
          0
        ],
        "scale": [
          1,
          1,
          1
        ]
      },
      "tags": [
        "prop"
      ],
      "collider": {
        "type": "box",
        "size": [
          1.5,
          0.8,
          0.8
        ],
        "offset": [
          0,
          0.4,
          0
        ]
      }
    }
  ],
  "navigation": {
    "grid": {
      "origin": [
        -2,
        -2
      ],
      "cell_size": 0.25,
      "width": 24,
      "height": 24,
      "walkable": [
        1,
        1,
        1,
        1,
        1,
        1,
        1,
        1,
        1,
        1,
        1,
        1,
        1,
        1,
        1,
        1,
        1,
        1,
        1,
        1,
        1,
        1,
        1,
        1,
        1,
        1,
        1,
        1,
        1,
        1,
        1,
        1,
        1,
        1,
        1,
        1,
        1,
        1,
        1,
        1,
        1,
        1,
        1,
        1,
        1,
        1,
        1,
        1,
        1,
        1,
        1,
        1,
        1,
        1,
        1,
        1,
        1,
        1,
        1,
        1,
        1,
        1,
        1,
        1,
        1,
        1,
        1,
        1,
        1,
        1,
        1,
        1,
        1,
        1,
        1,
        1,
        1,
        1,
        1,
        1,
        1,
        1,
        1,
        1,
        1,
        1,
        1,
        1,
        1,
        1,
        1,
        1,
        1,
        1,
        1,
        1,
        1,
        1,
        1,
        1,
        1,
        1,
        1,
        1,
        1,
        1,
        1,
        1,
        1,
        1,
        1,
        1,
        1,
        1,
        1,
        1,
        1,
        1,
        1,
        1,
        1,
        1,
        1,
        1,
        0,
        0,
        0,
        1,
        1,
        1,
        1,
        1,
        1,
        1,
        1,
        1,
        1,
        1,
        1,
        1,
        1,
        1,
        1,
        1,
        1,
        1,
        1,
        1,
        0,
        0,
        0,
        1,
        1,
        1,
        1,
        1,
        1,
        1,
        1,
        1,
        1,
        1,
        1,
        1,
        1,
        1,
        1,
        1,
        1,
        1,
        1,
        1,
        0,
        0,
        0,
        0,
        0,
        0,
        0,
        0,
        0,
        0,
        1,
        1,
        1,
        1,
        1,
        1,
        1,
        1,
        1,
        1,
        1,
        1,
        1,
        1,
        1,
        1,
        0,
        0,
        0,
        0,
        0,
        0,
        0,
        0,
        1,
        1,
        1,
        1,
        1,
        1,
        1,
        1,
        1,
        1,
        1,
        1,
        1,
        1,
        1,
        1,
        0,
        0,
        0,
        0,
        0,
        0,
        0,
        0,
        1,
        1,
        1,
        1,
        1,
        1,
        1,
        1,
        1,
        1,
        1,
        1,
        1,
        1,
        1,
        1,
        0,
        0,
        0,
        0,
        0,
        0,
        0,
        0,
        1,
        1,
        1,
        1,
        1,
        1,
        1,
        1,
        1,
        1,
        1,
        1,
        1,
        1,
        1,
        1,
        0,
        0,
        0,
        0,
        0,
        0,
        0,
        0,
        1,
        1,
        1,
        1,
        1,
        1,
        1,
        1,
        1,
        1,
        1,
        1,
        1,
        1,
        1,
        1,
        1,
        1,
        1,
        1,
        1,
        1,
        1,
        1,
        1,
        1,
        1,
        1,
        1,
        1,
        1,
        1,
        1,
        1,
        1,
        1,
        1,
        1,
        1,
        1,
        1,
        1,
        1,
        1,
        1,
        1,
        1,
        1,
        1,
        1,
        1,
        1,
        1,
        1,
        1,
        1,
        1,
        1,
        1,
        1,
        1,
        1,
        1,
        1,
        1,
        1,
        1,
        1,
        1,
        1,
        1,
        1,
        1,
        1,
        1,
        1,
        1,
        1,
        1,
        1,
        1,
        1,
        1,
        0,
        0,
        0,
        0,
        0,
        0,
        1,
        1,
        1,
        1,
        1,
        1,
        1,
        1,
        1,
        1,
        1,
        1,
        1,
        1,
        1,
        1,
        1,
        1,
        0,
        0,
        0,
        0,
        0,
        0,
        1,
        1,
        1,
        1,
        1,
        1,
        1,
        1,
        1,
        1,
        1,
        1,
        1,
        1,
        1,
        1,
        1,
        1,
        0,
        0,
        0,
        0,
        0,
        0,
        1,
        1,
        1,
        1,
        1,
        1,
        1,
        1,
        1,
        1,
        1,
        1,
        1,
        1,
        1,
        1,
        1,
        1,
        0,
        0,
        0,
        0,
        0,
        0,
        1,
        1,
        1,
        1,
        1,
        1,
        1,
        1,
        1,
        1,
        1,
        1,
        1,
        1,
        1,
        1,
        1,
        1,
        1,
        1,
        1,
        1,
        1,
        1,
        1,
        1,
        1,
        1,
        1,
        1,
        1,
        1,
        1,
        1,
        1,
        1,
        1,
        1,
        1,
        1,
        1,
        1,
        1,
        1,
        1,
        1,
        1,
        1,
        1,
        1,
        1,
        1,
        1,
        1,
        1,
        1,
        1,
        1,
        1,
        1,
        1,
        1,
        1,
        1,
        1,
        1,
        1,
        1,
        1,
        1,
        1,
        1,
        1,
        1,
        1,
        1,
        1,
        1,
        1,
        1,
        1,
        1,
        1,
        1,
        1,